uid,body,title,url,newspaper_uid,host,n_tokens_title,n_tokens_body
6103293cf23b7acfbb3ce6acc1c9d255,"Falo era un hombre que se pintaba de rubio el cabello, que usaba camisas estrafalarias, pantalones blancos o de colores  acampanados, eran los años sesenta, Kika lo veía como un muxe yoxho (homosexual anciano) que irrumpía con su atuendo las calles y las fiestas de Juchitán, era la época previa  a  Las  Intrépidas, al  movimiento festivo que visibilizó a nivel mundial esta comunidad zapoteca a través de una fiesta.Enrique Godínez, La Kika, recuerda que las muxes de los años sesenta en Juchitán, como Falo, aunque seguían  la moda juvenil, no se ponían las guayaberas bordadas estridentes como las empezó a usar el fundador de la Vela de las Auténticas Intrépidas Buscadoras del Peligro, Oscar Cazorla,  mucho menos se vestían con el traje regional en los espacios públicos, a lo mucho en el espacio privado, sin salir de sus casas.Foto: Roselia Chaca“Recuerdo un muxe de la Segunda Sección que se paraba en la puerta de su casa,  desde lejos se podía ver que usaba una enagua del diario sobre el cuerpo, como si fuera un vestido, pero cuando salía a la calle usaba camisas floreadas. Antes de las intrépidas,  algunos usaban una flor en la cabeza o en los sombreros, sólo se pintaban los labios y vestían ropa varonil, no eran femeninas como ahora,  por esos detalles se sabía que eran muxes”, dice el activista de 50 años sobre la  imagen de uno de los primeros muxes que vio.Botones de oroEn los años 30 a 50, los muxes eran más discretos,  se “delataban” por los botones de oro en las camisas, chanclas femeninas o  una flor en la cabeza, quizá un poco de polvo en el rostro, eran compañeros inseparables de las  taberneras (mujeres que vendían cervezas en las Velas y fiestas patronales de los pueblos), viudas o  madres solteras,  al menos así los recuerda Gabina Vásquez, tabernera de 84 años.“Los muxes de antes no se vestían de enagua como ahora, si se pintaban la boca ya era mucho. En mi juventud vi unos que a sus camisas les ponían botones de oro,  eran muxes que tenían dinero porque eran comerciantes, trabajaban mucho para tener esos lujos que los distinguían”, recuerda Gabina. Kika hace memoria y le viene a la cabeza  el nombre de Angélica, una muxe de la Séptima Sección,  como la primera  que usó la ropa femenina de las zapotecas en  su vida diaria, después vinieron otras como Felina, Mística y una larga lista hasta el día de hoy.No soy él  o  ella, soy muxe y ya“La primera que usó enagua y  huipil fue Angélica... después vino el boom de las ‘vestidas’ con las intrépidas, ya no se  transformaban en la clandestinidad,  hicieron propia la vestimenta de las mujeres en la casa y en las fiestas”, rememora Kika Godínez sobre cómo se ha transitando la identidad muxe hacia lo femenino.Para el también director de la  Diversidad Sexual del municipio de Juchitán, a un gran sector de los muxes no les importa si los  denominan  “ella”,  “él”  o “elles”, la elección queda a criterio e identidad de cada persona: “No soy él  o  ella, soy muxe y ya”, refiere.La transformación del cuerpoFoto: Roselia ChacaEn el año 2000, las muxes que habían ido a la capital del país a probar fortuna, algunas en la prostitución, empezaron a transformar sus cuerpos en función del negocio, primero tomando hormonas, luego sometiéndose a operaciones estéticas para tener  pechos, caderas y glúteos muy pronunciados.Naomi Méndez, por ejemplo, es una mujer trans de 26 años que comenzó a hormonizarse desde los 18, pero hace un año se puso implantes de senos. Pero su sueño no termina con su 34 B: quiere convertirse en la primera muxe en hacerse el cambio de sexo.  “No sólo cambié mi cuerpo, también mi nombre ante el Registro Civil... esto de transformar el cuerpo es un asunto generacional, antes lo hacían las que se dedicaban a la prostitución, ahora es para sentirte acorde con tu identidad”.        —También te interesará:ArtículoMujer muxe protagoniza portada de Vogue México y LatinoaméricaSociedadEl tercer género del Istmo de Tehuantepec engalana la portada de diciembre Naomi identifica tres formas de ser muxe:  nguiu (el que usa vestimenta varonil),  gunaa (la que se viste de mujer  o se trasviste) y muxe  trans (la que se viste de mujer y ha trasformado su cuerpo), de estas últimas en  Juchitán existen por lo menos 40 personas.El poeta Elvis Guerra, por su parte, considera que  existe una nueva generación de muxes, como él, que  han decidio inclinarse por lo “binario”, es decir, que    se visten de hombre o  de mujer, pero no de  ambos, lo que permite que puden relacionarse con alguien que asume el otro género. Esto le ha traído crítica y discriminación de la misma comunidad, pero considera esta forma de identificación como parte natural de la evolución de la muxeidad.“En mi  investigación para mi último libro sobre las Ramonas descubrí que muchas muxes  ‘se voltean’, pero  no lo aceptan, porque echa abajo lo que se piensa  de ellas, que  no  mantienen relaciones con otro muxe”.        —También te interesará:ArtículoPresentan mujeres trans zapotecas proyecto contra la violencia en la comunidad Muxe MunicipiosBuscan crear vínculos con la Fiscalía y la comunidad LGBT, para dar atención y seguimiento a los casos de violencia  ",¿La identidad muxe evoluciona?,https://oaxaca.eluniversal.com.mx/sociedad/20-11-2019/la-identidad-muxe-evoluciona,eluniversal,oaxaca.eluniversal.com.mx,3,417
7ee1afff1a184f9f477650d593dcbfd7,"    googletag.cmd.push(function() {      googletag.display(""dfp-ad-top3_content"");    });  El trámite de la Licencia de conducir Tipo A-1 y Tipo A lo realizan personas físicas, conductores de vehículos particulares.Licencia de conducir en CDMX paso a paso1. Genera tu línea de captura en la página web de la Secretaría de Finanzas de la Ciudad de México.2. Presentarte en el área de atención ciudadana (módulos centrales y delegacionales de Licencias y Centros de Servicios autorizados) con el pago de derechos y los documentos solicitados.3. El servidor público que realiza el trámite recibirá, revisará y cotejará los documentos que presentes, emitirá e imprimirá la hoja de datos para la revisión del ciudadano.4. Checa la hoja de datos, revisa que la información esté correcta y si es el caso, firma de conformidad.5. Una vez que se entrega la hoja de datos firmada, el interesaro pasa a tomarse la fotografía.6. El siguiente paso es el firma y registro de huella digital7. Entrega Licencia de Conducir Tipo “A”Requisitos para sacar la licencia1. Documentos en original y copiaIdentificación oficialCredencial para Votar Cartilla del Servicio Militar Nacional Cédula Profesional Pasaporte Tarjeta de residencia 2. Comprobantes de domicilio. Deberá ser presentado con una vigencia no mayor de 90 días, o del último bimestre.Boleta del Servicio de Agua Estado de cuenta de servicio telefónico Boleta del Impuesto Predial Estado de cuenta bancario Recibo del Servicio de Luz Certificado de Residencia 3. Comprobante de pago de derechosCosto de la licencia837.50 pesos. El pago se puede realizar en bancos y tiendas de autoservicio o en línea. Con información del Gobierno de la Ciudad de MéxicoMÁS INFORMACIÓN SOBRE TRÁMITES DE LA CDMX:¿Cómo sacar tu RFC en el SAT?Cómo registrar a un bebé en CDMX: Requisitos¿Cómo darte de baja en el IMSS?   ",Licencia para conducir CDMX: Trámite paso a paso,http://www.unioncdmx.mx/articulo/2019/11/19/transporte/licencia-para-conducir-cdmx-tramite-paso-paso,eluniversal,www.unioncdmx.mx,6,144
e65bfd2dba6cae1fa653ca621bc0f76f,"    googletag.cmd.push(function() {      googletag.display(""dfp-ad-top3_content"");    });  Este 22 de noviembre se celebra el Día del Músico. Esto debido a que se festeja también a Santa Cecilia, a quien se considera como la patrona de los músicos.Muchos autores y artistas de todos los géneros han hablado sobre el valor de la música para la humanidad. El Papa Gregorio XIII declaró a Santa Cecilia como Patrona de los Músicos, en 1584. En el día de su matrimonio, Cecilia cantó a Dios en su corazón mientras los músicos tocaban; durante la Edad Media, empezó a representarse a la santa tocando el órgano y cantando. Por esta razón, es la patrona de los músicos.Frases para el Día de los MúsicosLa música es realmente la mediadora entre la vida de los sentidos y el espíritu. Ludwing Van BeethovenLa música compone los ánimos descompuestos, y alivia los trabajos que nacen del espíritu. Miguel de Cervantes SaavedraLa música es el amor en busca de palabras. Sydney LanierSin la música, la vida sería un error. Nietzsche La música es el tipo de arte que está más cerca de las lágrimas y la memoria. Oscar WildeLa música expresa lo que no puede ser dicho y aquello sobre lo que es imposible permanecer en silencio. Víctor HugoLa música es la taquigrafía de la emoción. León TolstoiLa música es una forma de soñar. Jaime Torres BodetLa música es el territorio donde nada nos hace daño. Andrés CalamaroLa música puede cambiar el mundo porque puede cambiar a las personas. BonoLa música tiene poder sanador. Tiene la habilidad de sacar a la gente fuera de si mismas durante unas horas. Elton JohnEl rock es una piscina, el jazz es todo un océano. Carlos SantanaAlgo bueno de la música. Cuando te golpea, no sientes dolor. Bob MarleyLa música no la tienes que traducir. Simplemente te afecta y no sabes porqué. David Byrne.Deja de tocar la guitarra un día y lo notarás tú. Deja de tocarla dos días y lo notará tu maestro. Deja de tocarla tres y empezará a notarlo el público. Jimmy PageLa música es la aritmética de los sonidos, como la óptica es la geometría de la luz. Claude DebussyTE PUEDE INTERESAR:Santa Cecilia, el majestuoso castillo de Guanajuato   ",Frases para el Día del Músico,http://www.unionpuebla.mx/articulo/2019/11/21/cultura/frases-para-el-dia-del-musico,eluniversal,www.unionpuebla.mx,3,185
ad659937f44ac75284ca8653c3ec182a,"TECÁMAC.Un hombre asesinó a su pareja en medio de una discusión en este municipio; según las primeras versiones, al inicio se escuchó una serie de gritos y reclamos, mismos que terminaron con el homicidio de la víctima.ESCUCHAN GRITOS. La mañana de ayer, los residentes del callejón Calvario, esquina Margaritas, escucharon a una pareja discutir alrededor de las 8:30 horas, pero fue hasta poco después que descubrieron a la mujer sin vida atrás de las instalaciones de una empresa refresquera. Fueron patrulleros estatales quienes atendieron el reporte de una mujer inconsciente con una gran herida en la cabeza, presuntamente provocada con un tabique.Paramédicos locales revisaron a la mujer y determinaron su fallecimiento, aparentemente a causa de golpes contusos en la cabeza. Los vecinos no identificaron a la víctima como residente de la zona.El lugar del hallazgo fue resguardado por los uniformados hasta que los servicios periciales acudieron a realizar las diligencias correspondientes.Personal de la Fiscalía de Feminicidios de Ecatepec iniciaron la investigación respectiva bajo el protocolo de feminicidio.",mujer muere asesinada por su novio en tecamac recibio tabicazo tras pelea,https://www.elgrafico.mx/la-roja/mujer-muere-asesinada-por-su-novio-en-tecamac-recibio-tabicazo-tras-pelea,eluniversal,www.elgrafico.mx,9,81
5921590d9c218bdbf33252a16092e3e2,"El Black Friday es la fecha más importante de compras en Estados Unidos y la nueva fiebre por las transacciones en línea podrían hacer vulnerables a los clientes de ser víctimas de una estafa. Para no terminar con cuentas exorbitantes, cargos no reconocidos en las tarjetas de crédito y artículos que jamás llegan a su comprador, los clientes deben tomar ciertas precauciones antes de iniciar el “Viernes Negro”. Sitios seguros para el Black Friday  La organización Better Business Bureau recomienda siempre investigar al anunciante que ofrece las promociones. Es necesario revisar que el sitio web cuente con la certificación “https”, de sitio seguro u muestre el candado cerrado en color verde al inicio del link. También es importante sólo ingresar a los sitios oficiales de tiendas reconocidas como Amazon, Walmart, Best Buy y otros establecimientos que puedan responder ante cualquier posible estafa. Visita Consejos para arrasar en las ofertas de Black Friday El próximo viernes 29 de noviembre es el Black Friday 2019 en Estados Unidos  No es bueno confiar en las ofertas que llegan por correo electrónico, redes sociales o mensajes, especialmente si provienen de remitentes a los que no está suscrito el cliente. Los estafadores utilizan diseños similares a los de tiendas reconocidas para suplantar su identidad. Los consumidores que dan clic a este tipo de enlaces están en riesgo de descargar un malware o entregar su información a quienes pueden hacer mal uso de ella. Métodos de pago para el Black Friday Better Business Bureau también recomienda hacer todas las compras online del Black Friday y el Cyber Monday con tarjeta de crédito, de esta forma será más sencillo realizar reclamos por cargos no realizados. Con la tarjeta de débito es complicado pedir la devolución del dinero que se descontó inmediatamente después de la compra. Al comprar en diferentes tiendas en línea es importante crear cuentas con diferentes contraseñas y comenzar a sospechar de un fraude si la clave falla en repetidas ocasiones. Los estafadores también aprovechan las tarjetas de regalo para embaucar a las personas. Roban las tarjetas y luego las revenden en línea por un precio tan bajo que atrae a los compradores. No obstante, es posible desactivar el número para que el cliente no pueda utilizarla, de acuerdo con el Buró Federal de Investigaciones (FBI). No caigas en publicidad engañosa Las tiendas pueden tener condiciones o cargos extra en las ofertas del Black Friday, por lo que es importante leer todos los términos de las promociones adquiridas en tiendas físicas y por internet. Precauciones extra para el Black Friday y el Cyber Monday Instala un antivirus bueno en los dispositivos electrónicos donde realizarás las compras en línea. Guarda los comprobantes de todas las transacciones que realizas en el “Viernes Negro”. Nunca otorgues los datos de tus tarjetas bancarias por teléfono. No respondas a correos o mensajes que no fueron solicitados. Desconfía de todas las ofertas que sean demasiado buenas. ¿Cuándo es el Black Friday? El Black Friday se celebra oficialmente al día siguiente del Día de Acción de Gracias. Este 2019 se realizará el 29 de noviembre, aunque algunas ofertas iniciarán desde el jueves 28, después de la cena de Thanksgiving. Lee tambiénAmazon publica sus primeras rebajas antes del Black FridayLas ofertas estarán disponibles hasta el 21 de noviembre y regresarán para el ""Viernes Negro"" y el ""Cyber Monday""  ",tips para evitar ser victima de fraude en el black friday,https://www.viveusa.mx/compras/tips-para-evitar-ser-victima-de-fraude-en-el-black-friday,eluniversal,www.viveusa.mx,7,303
ee8cf59b8a89fb768881c76f875c400c,"    googletag.cmd.push(function() {      googletag.display(""dfp-ad-top3_content"");    });  Del 19 al 22 de diciembre, se realizará la edición XXXIV de la Feria Internacional de la Piñata 2019 en el municipio de Acolman.Esta feria contará con diversas actividades como culturales recreativas y artísticas, a fin de enamorar a chicos y grandes.La Feria de la Piñata Acolman 2019 contará con pabellones artesanal y gastronómico.Qué artistas estarán en la Feria de la Piñata 2019UN1ÓN Edomex te dice el día qué se presentarán los artistas a esta feria internacional del Estado de México.-19 de diciembre: Francisco Céspedes-20 de diciembre: Inspector-21 de diciembre: El TRI-22 de diciembre: Chuy Lizárraga  La entradas a los conciertos de la Feria de la Piñata Acolman 2019 es libre.VER: Villa Navideña Naucalpan 2019: Lo que debes saber",Feria de la Piñata Acolman 2019: El cartel completo,http://www.unionedomex.mx/articulo/2019/11/20/cultura/feria-de-la-pinata-acolman-2019-el-cartel-completo,eluniversal,www.unionedomex.mx,5,52
167bb18590fafb6cb7c6274f0ddb1dc2,"    googletag.cmd.push(function() {      googletag.display(""dfp-ad-top3_content"");    });  Los cenotes son uno de los atractivos en Yucatán, sobre todo porque son naturales, accesibles y hay cientos en la Península.No en todos se puede nadar, si quieres saber de algunos donde sí, puedes revisar esta nota:VER: CENOTES DONDE SE PUEDE NADAR EN YUCATÁNConsejos para nadar en un cenoteLos cenotes son lugares accesibles, pero no significa que no puedes correr peligro en ellos.*Usa ropa cómoda hasta llegar.*Utiliza repelente para moscos.*No se te olvide toalla y traje de baño.*Es mejor usar chaleco salvavidas o flotadores, en algunos lugares los rentan.*Lleva comida o refrigerio, aunque sólo podrás comer fuera de los cenotes.*Lleva bolsas para ropa mojada y basura.*Cuida a los menores si es que viajas con ellos.*Prefiere los cenotes donde haya gente, pues algunos son poco accesibles y por lo tanto si algo te pasa, no podrán salvarte.También lee: Qué hacer en Valladolid, Yucatán ",Tips para nadar en cenotes de Yucatán,http://www.unionyucatan.mx/articulo/2019/11/21/turismo/tips-para-nadar-en-cenotes-de-yucatan,eluniversal,www.unionyucatan.mx,4,70
a1009860ab18db7e85492181f49c4638,"Mario Reyes no puede decir un año exacto. Lo único que saben  él y sus hermanos,  Victorino y Rufino, es que la música de viento ha sido parte de su familia desde  los tiempos de su tatarabuelo, José Reyes, antes de la Revolución Mexicana.Con 74 años, Mario es el mayor de siete hermanos, de los cuales los cuatro varones, como casi todos los hombres de la familia Reyes, tomaron el camino de las partituras y las notas desde muy pequeños. Es lo que han hecho siempre.Él y sus hermanos  las aprendieron de su padre Alfredo y de su abuelo Lorenzo. Así es como los sonidos de los instrumentos de viento  perviven en esta familia: músico viejo enseña a músico joven, platican entre risas.Acostumbrados a la memoria, los Reyes no tienen otra forma de reconstruir su pasado musical más que confiando en lo que recuerdan que les contaron los abuelos, que a su vez les fue transmitido también por la palabra, hasta llegar a un momento en el pasado  donde los recuerdos ya no alcanzan.Y la tradición oral muere en el tiempo.Aún así, han logrado rastrear los orígenes de su apellido hasta los años 1600, cuando el tronco de los Reyes, junto con otros de las familias principales del pueblo, las más viejas de esta comunidad de raíces zapotecas, defendieron sus tierras de un cacíque de la región.Ellos ganaron y el triunfo quedó plasmado en un documento antiguo en poder de la familia, donde se narra esta disputa  encabezada por “los indios de Ixtlahuaca”. Lo que no dice el papel, es si entonces ya se dedicaban, entre la  pugna por  tierras, a vivir de la  música.Pese a ello, saben que su herencia no puede ser otra si no las notas  que han tocado siempre y que sus propios hijos varones ya han adoptado como forma de vida.En el caso de Mario, sus tres hijos y sus tres nietos ya han pasado por esta banda familiar; en el caso de Victorino, de 69 años, son dos hijos y dos nietos, mientras que Rufino, de 60, sólo tiene un hijo en la banda, pues sus nietos aún no tienen la edad para incorporarse.No basta el talento. “Necesitas trabajar por el sustento, si quieres ser borracho, sé músico”, recuerda Mario que le decían cuando a los 12 años decidió que seguiría la tradición familiar. Pero, aunque ser músico se ha entendido más como  un pasatiempo que como  una forma de ganarse la vida, en el caso de los Reyes  la entrada no es sencilla, ni tener el apellido basta.La música es como una familiaCuando uno de los hijos o nietos  decide que es momento de formar parte de la banda familiar, lo primero que tiene que hacer es tomar un método de enseñanza compuesto de 58 lecciones, las necesarias para aprender solfeo y leer los mensajes encriptados en las partituras y los pentagramas. Lo demás sólo se trata de talento, que a los Reyes no les falta.Mario, por ejemplo, sabe tocar el barítono, la trompeta y el clarinete. Victorino, la trompeta,  saxofón alto y clarín, mientras que Rufino domina la trompeta y el trombón.El encargado de impartir las lecciones a quienes aspiran a integrarse a la banda familiar son los responsables de la banda, que pueden durar por varios años hasta que “entregan” y entonces todos los integrantes vuelven a elegir a un responsable, quien, además de las lecciones, tiene la responsabilidad de amarrar los contratos y  de convocar a los ensayos. “La música es como una familia, no dejas de estar hablando. Puedes estar sacando una pieza y compartirlo, así es la comunicación del músico”, cuenta Victorino.Actualmente son dos los que llevan a cabo dichas actividades, pues con 17, se trata de la primera vez que la banda cuenta con tantos integrantes, lo que les permite contar con tres trompetas, tres clarines, tres trombones y una tuba, entre otros instrumentos.Foto: Edwin HernándezLa pérdida. “Ya es puro ruido, pura música carnavalera”, dice Victorino sobre la pérdida que actualmente se vive de los sonidos tradicionales, como la música sacra o las marchas fúnebres, las cuales se han ido olvidando en el tiempo porque la misma gente ya no las pide.Victorino recuerda, por ejemplo, que fue   hace como cinco años cuando les pidieron por última vez que acompañaran el sepelio de un difunto con las notas de una marcha fúnebre. De su catálogo familiar, que está compuesto por unas 500 piezas, calculan, unas 60 son piezas fúnebres cuyas notas podrían desaparecer.—¿Ya no los contratan para acompañar  los sepelios?—Sí, pero ahora lo que piden son jarabes y chilenas, se perdió lo solemnidad del difunto y ahora es como una fiesta, dice este músico de seis décadas, que incluso reconoce que hay piezas fúnebres y sacras que él ya nunca tocó.No es lo único que se ha perdido. Aunque dice que nunca se han quedado sin tocar y que diciembre es su mejor mes, con hasta cuatro tocadas por semana, explica que ya son pocos quienes aceptan pagar 7 mil pesos por un día de música.Foto: Edwin HernándezOtro problema es el surgimiento de más agrupaciones. De ser la única banda del pueblo, por ejemplo, pasaron a existir cinco, la mayoría integrada por músicos sin tradición. Son a esas a las que Victorino se refiere como “carnavaleras”.“Cuando uno sale, es el nombre del pueblo el que va adelante, luego pregunta de dónde somos y dicen ah, es la banda de San Pedro. Es un orgullo”, explica Mario sobre ese prestigio comunitario, otra de las pérdidas que ha traído el tiempo a quienes como ellos viven de dar cuerpo a los sonidos.Los hermanos calculan  que hasta hace 20 años, ser músicos era la forma en la que ellos hacían tequio al pueblo, tocando en eventos cívicos y religiosos, y excluyéndolos de cooperaciones o de cumplir con cargos como policías o mayordomos,  algo que incluso les dejó el apodo de Moleros, pues en cada festividad a la que asistían se les servia mole como platillo.Lo único que ha traído la modernidad, bromean, es que ahora también los contratan candidatos.Los Reyes calculan que hasta hace 20 años, ser músicos era la forma en la que ellos hacían tequio al pueblo, algo que incluso les dejó el apodo de Moleros Conoce su historia https://t.co/O3xheQCrDP pic.twitter.com/5ocw5kR646— El Universal Oaxaca (@ElUniversalOax) November 18, 2019","Banda Reyes, la música pervive 5 generaciones",https://oaxaca.eluniversal.com.mx/sociedad/17-11-2019/banda-reyes-la-musica-pervive-5-generaciones,eluniversal,oaxaca.eluniversal.com.mx,5,488
