uid,body,title,url,newspaper_uid,host,n_tokens_title,n_tokens_body
46d73d2a0f44b23705f24bbe84055322," Estimados senadores de Morena: nuestro presidente López Obrador tiene toda la razón cuando dice que en los otros gobiernos, todo se hacía en lo “oscurito”. ¡Qué bárbaro! ¡Cuánta razón tiene! Todas las movidas y corrupciones que se realizaron durante los últimos sexenios en lo oscurito fueron tremendas. Es por esta razón la cual les dedico mi carta semanal. Una carta semanal que me llena de orgullo escribir por lo transparente que son con sus actividades dentro de la Cámara. En primer lugar, felicitarlos por su enorme transparencia y humildad al admitir que son mayoría relativa. Son tan transparentes, que muchos senadores de su bancada admiten abiertamente que no tienen ningún título universitario. También admiten, con esa transparencia que los ilumina, que NUNCA habían ganado un sueldo de 100 mil pesos al mes. Admiten que es un sueldazo comparado al que ganaban antes de entrar a trabajar en la Cámara. Estos mismos senadores, admiten y demuestran con esa enorme transparencia, que tienen un PODER que nunca se hubieran imaginado. Todos ustedes admiten con una generosa transparencia que le deben todo a nuestro presidente y que por ende, lo que él les ordene, ustedes obedecerán sin ningún cuestionamiento. Y es en este tema a donde justamente quiero llegar. A la elección de la señora Piedra. La nueva presidenta de la Comisión Nacional de los Derechos Humanos. Si les parece bien, iniciemos con los antecedentes: la orden presidencial a su presidente Ricardo Monreal. El presidente con toda la transparencia del mundo le ORDENÓ a Monreal que postule a la señora Piedra. Porque él como presidente de la República y de la mitad de los mexicanos, necesita tener una aliada que no cuestione sus decisiones. Y aunque muchos de ustedes, ya tenían a su candidato (a) obedecieron como siempre y la postularon. Viene la primera votación y ¡pum! La señora Piedra no llega a la mayoría calificada. Llega la segunda votación, y otra vez ¡pum! La candidata tampoco llegó. ¿Qué haremos para esta tercera elección preguntó uno de ustedes a Monreal? Y con la serenidad que le caracteriza a su jefe, él les dijo lo siguiente: “hagamos trampa ¡pero eso sí, hagámosla con toda la transparencia del mundo!”. Y les advierto… ¡¡¡Nada en lo oscurito!!! Otro de sus senadores colegas comentó: “¡Pero ya las hicimos EN LAS PRIMERAS dos!” “La señora Piedra ¡NO REÚNE NINGUNO DE LOS REQUISITOS!” ¿Y esa trampa fue transparente? Todos los senadores le contestaron en coro “¡POR SUPUESTO QUE SI!”. !Ah, bueno!, contestó Ricardo. “Si toda esta trampa es transparente, entonces no hay bronca”. “¡En esta tercera elección, agreguemos los dos votos faltantes en las urnas y asunto resuelto!”. Y con esa SUPER TRAMPA TRANSPARENTE, la señora Piedra ganó. Antes de ayer, la señora Piedra, tomó posesión. Nadie le aplaudió. Cinco consejeros le renunciaron. El gobernador de Querétaro anunció que no reconocerán a la titular de la CNDH. Y la Asociación de Alcaldes tampoco. Pero eso sí. El senador Monreal, con toda la transparencia del mundo, regañó y amenazó a estos rebeldes. Les dijo textualmente: “¡Con toda la transparencia del mundo, ustedes no pueden mandar al diablo a las instituciones y violar la ley!”. Y entre murmullo y murmullo, él se dijo en secreto: (¡Pero nosotros SÍ jajajaja!). Pero eso sí. El senador Monreal se quedó callado hace varios años cuando alguien de su partido hizo el mismo comentario. Y como final de esta Carta Semanal: si ustedes me preguntan qué opino de estos senadores, mi respuesta es muy fácil. NO SON UNAS RATAS. ¡SON UNOS CANGUROS! P.D. Señora Sheinbaum: ¿me puede explicar de qué se rió cuando el caballista militar se cayó del caballo en el desfile de ayer? Y si no me cree, cheque los videos. Ya están circulando en las redes. Por último: Semana 27 del asesinato a mi colaboradora Ely Gutiérrez.  27 semanas sin saber nada. ¡Vaya ineficiencia! [email protected]",Carta dirigida a los senadores de Morena (Nada en lo “oscurito”. Todo ¡trans-pa-ren-te!),https://www.eluniversal.com.mx/opinion/carlos-alazraki/carta-dirigida-los-senadores-de-morena-nada-en-lo-oscurito-todo-trans-pa-ren,eluniversal,www.eluniversal.com.mx,5,310
ed7c2bb95fd589ad2427c1648bdfebad,"La Asociación Nacional de Alcaldes (ANAC) informó que no reconoce ni atenderá las recomendaciones de Rosario Piedra, como presidenta de la Comisión Nacional de los Derechos Humanos (CNDH).La agrupación panista que encabeza el alcalde de Huixquilucan, Enrique Vargas, sostuvo que al igual que la Asociación Nacional de Gobernadores del PAN (Goan), no la reconocen por haber surgido de un proceso “amañado” y sin y transparencia.Actualmente, el PAN cuenta con 399 alcaldes y 10 gobernadores en Chihuahua, Tamaulipas, Baja California Sur, Querétaro, Aguascalientes, Durango, Yucatán, Quintana Roo, Nayarit y Guanajuato.“Al igual que la Goan no reconocemos ni haremos caso a las recomendaciones de Rosario Ibarra como presidenta de la CNDH. Se eligió sin transparencia en un proceso amañado, además de no cumplir con la institucionalidad que se requiere siendo militante de Morena”, escribió en sus redes la ANAC, sostuvo Enrique Vargas.Por su parte, el presidente de México, Andrés Manuel López Obrador, aseguró que es natural que el PAN no acepte a Rosario Piedra porque a los conservadores les molesta que la hija de una activista como doña Rosario Ibarra de Piedra encabece la defensa de los derechos humanos.“Imagínese para un conservador el que esté una hija de doña Rosario en la CNDH, les molesta, pero se me hace un exceso, es un acto de intolerancia, de falta de respeto, porque detrás de esa postura, no hablo del gobernador [Francisco Domínguez], sino del pensamiento conservador, esta es una actitud revanchista”, expresó.El lunes, el gobernador de Querétaro, Francisco Domínguez, dijo que la entidad desconocerá cualquier acción o recomendación emitida por la titular de la CNDH.El pasado 12 de noviembre, la Asociación Nacional de Gobernadores del PAN anunció que desconocerían a Piedra Ibarra como presidenta de la CNDH, y no atenderían sus recomendaciones.“No reconocemos ni reconoceremos la autoridad de quien es producto de un fraude. Nuestro compromiso es con el Estado de Derecho”, externaron.",Alcaldes de Acción Nacional desconocen a nueva titular de la CNDH,https://www.eluniversalqueretaro.mx/portada/alcaldes-desconocen-nueva-titular-de-la-cndh,eluniversal,www.eluniversalqueretaro.mx,7,159
11c4033597c18592dad1e81e5a254fbe,"La sangre derramada de un coche, alertó a habitantes de la alcaldía Tlalpan en la Ciudad de México. Dentro de la cajuela hallaron el cadáver de una persona.En una calle con poco tránsito de la colonia Miguel Hidalgo Tercera Sección, fue abandonado el automóvil Jetta de modelo viejo.Fueron los vecinos de la calle Flores Magón quienes al amanecer encontraron el vehículo estacionado frente a la barda de una casa.Al ver un hilo de sangre que salía de la cajuela, pidieron ayuda de los policías. Los agentes que atendieron el caso, hallaron el cadáver de una persona que no fue identificada.AHORA  Auto chorrea sangre y vecinos descubren cadáver en la cajuela, en una calle de poco tránsito de la alcaldía Tlalpan en la Ciudad de México. Imágenes de Yara Silva https://t.co/VtD4oVHs7K pic.twitter.com/G68O6aDcNg— El Gráfico (@elgmx) 21 de noviembre de 2019",auto chorrea sangre y vecinos descubren cadaver en la cajuela en tlalpan,https://www.elgrafico.mx/la-roja/auto-chorrea-sangre-y-vecinos-descubren-cadaver-en-la-cajuela-en-tlalpan,eluniversal,www.elgrafico.mx,8,68
612714ab910f8d347718a37fc211cd4c,"Los diputados integrantes de la Comisión de Puntos Constitucionales del Congreso del Estado rechazaron la propuesta del diputado Pedro César Carrizales Becerra, de llevar el derecho a la interrupción legal del embarazo a la Constitución Política de San Luis Potosí, puesto que según los legisladores “es improcedente”.De acuerdo a información del propio Poder Legislativo del Estado, esta comisión declaró improcedente la reforma al artículo 16 y adicionar dos párrafos al artículo 12 de la Constitución del Estado, en donde se incluiría el derecho de las mujeres potosinas a la interrupción legal del embarazo hasta antes de las 12 semanas de gestación.Las diputadas que calificaron de improcedente la propuesta son Paola Arreola, Sonia Mendoza Díaz, María Isabel González Tovar y los diputados Mauricio Ramírez Konishi y Cándido Ochoa Rojas, quienes a pesar de que en al menos dos entidades de la república ya se dio esta despenalización apartaron a la entidad potosina de esta determinación histórica.En este sentido, la petista Paola Arreola aseguró que esta iniciativa presentada por un grupo de mujeres de la sociedad civil, así como por el diputado Pedro César Carrizales y respaldada por otras tres legisladoras, no cuenta con el respaldo ciudadano al menos en su distrito, puesto que según comentó en diálogo con sus representados le manifestaron mayoritariamente el rechazo a la propuesta y se pronunciaron por el respeto a la vida desde su concepción.Cabe destacar que la iniciativa todavía está por recorrer otras comisiones como la de Salud y  Derechos Humanos e Igualdad de Género, por lo que el rechazo aún no es definitivo y pudieran presentarse dos dictámenes contrarios al pleno del Congreso del Estado, uno a favor y otro en contra de la propuesta, lo cual se definiría ya por voto directo de parte de todos los legisladores locales.ArtículoAgenda pro aborto, motivo de mi destitución: “El Mijis”PolíticaLegislador señala que “casualmente” su salida se propone cuando se analizará este tema en la comisión de Derechos Humanos que preside [email protected]dllo",Diputados dan golpe a propuesta de despenalización del aborto impulsada por “El Mijis”,https://sanluis.eluniversal.com.mx/politica/20-11-2019/diputados-dan-golpe-propuesta-de-despenalizacion-del-aborto-impulsada-por-el,eluniversal,sanluis.eluniversal.com.mx,8,162
f6c3f21d7bc7289c8aee6481ebebba26,"El de ayer fue un día negro para el gobierno de la 4T en materia de seguridad. Porque si se evalúa al primer año del presidente Andrés Manuel López Obrador por sus cifras de inseguridad y violencia, el resultado es catastrófico: los primeros 12 meses de esta administración, a punto de cumplirse en 10 días, se perfilan ya como el año más violento de la historia reciente, a juzgar por las cifras oficiales de homicidios dolosos y de feminicidio que reportan, hasta el momento, 29 mil 547 asesinatos violentos tan solo de enero a octubre; algo que ya supera en casi mil ejecuciones, las 28 mil 868 registradas en todo el año 2018, el último de Peña Nieto, de acuerdo con los datos del Secretariado Ejecutivo del Sistema Nacional de Seguridad Pública.Si ya es oficial que la violencia del primero año de López Obrador será la más grave de la historia, a eso hay que añadirle las declaraciones que ayer hizo el gobernador de Tamaulipas, Francisco García Cabeza de Vaca, uno de los mandatarios panistas más incómodos para la 4T, quien puso el dedo en la llaga al definir como “narcoterrorismo”, la situación violenta que vive su estado, especialmente la frontera de Nuevo Laredo en las últimas semanas: “Hay situaciones de violencia que se están generando aquí y no vamos a tapar el sol con un dedo. Es el comportamiento de criminales que quieren de alguna manera provocar el caos, el pánico la inseguridad a través de actos de violencia, sobre todo promoviendo el miedo y el terror, su comportamiento es de narcoterrorismo es un tema muy delicado el que está habiendo y se tiene que actuar en consecuencia”.La palabra más evitada y temida para el gobierno en estos momentos, es precisamente la que invocó el gobernador Cabeza de Vaca. Y es tan incómoda y delicada, porque al equiparar la violencia desbordada del narcotráfico con el terrorismo, lo que se hace es que la problemática de violencia y criminalidad en México, entren en el radar y en las prioridades del gobierno de Estados Unidos, que según sus leyes de seguridad nacional, pueden y deben intervenir en aquellos países cuyos problemas por la acción de grupos “terroristas” representen una amenaza para la seguridad de los estadounidenses.Por algo el canciller Marcelo Ebrard y el gobierno lopezobradorista se han negado una y otra vez a que se clasifique como “terrorismo” a sucesos de violencia en México, como las masacres recientes de la familia LeBarón y Langford en Sonora.La declaración de García Cabeza de Vaca reconociendo que lo que pasa en México ya se convirtió en “narcoterrorismo”, proviniendo de un gobernador fronterizo como el de Tamaulipas tendrá un impacto sin duda del otro lado del Río Bravo y se convierte en una muy incómoda posición para el gobierno de López Obrador que no tiene muchos argumentos para defenderse porque las masacres y multihomicidios suman más de 663 víctimas en 149 ataques en este año. Y si se observa la crueldad cada vez mayor en la ejecución de civiles inocentes, niños, mujeres, jóvenes que son torturados, masacrados y baleados con armas de alto calibre y hasta quemados vivos, la pregunta y el tema que plantea Cabeza de Vaca es inevitable e ineludible ¿no es eso narcoterrorismo? ","2019, violencia histórica y ¿narcoterrorismo?",https://www.eluniversal.com.mx/opinion/salvador-garcia-soto/2019-violencia-historica-y-narcoterrorismo,eluniversal,www.eluniversal.com.mx,2,249
4d6ccd27546d388682bee27824f3d337,"La actriz Elsa Pataky irradió belleza y elegancia durante el evento Kissmass Time, de Women’s Secret, en Madrid. La celebridad española, de 43 años de edad, atrajo la atención de las cámaras con unos pantalones acampanados y una blusa negra de encaje, con tela traslúcida, que resaltó el sostén negro que portaba. Además, complementó el sensual outfit negro un cinturón de cuero, para destacar su diminuta cintura, así como con una serie de pulseras plateadas y zapatos altos oscuros.     Ver esta publicación en Instagram           Una publicación compartida de Elsa Pataky (@elsapatakyconfidential) el 20 Nov, 2019 a las 12:37 PST La esposa del actor Chris Hemsworth también lució sus bellas facciones con maquillaje discreto y su cara estuvo enmarcada por su cabellera en tono rubio platinado. Elsa Pataky se presentó en el Palacio de Santa Bárbara en Madrid, España, para el evento de la marca de lencería, pues su residencia oficial se encuentra en Australia, con su familia. Lee tambiénDemi Rose sorprende con minivestido transparente en LondresLa modelo curvy asistió a un evento de belleza ataviada con un atrevido look negro La actriz de las cintas de “Rápidos y Furiosos” tiene una figura tonificada gracias al ejercicio y ahora revelará todos sus secretos en un libro. Bajo el título de “Strong”, la modelo lanzará el libro el próximo 26 de noviembre, con una casa editorial australiana. No obstante, en 2014 también publicó un libro de ejercicios en España, con el nombre de “Max”.     Ver esta publicación en Instagram           Una publicación compartida de Women'secret (@womensecretofficial) el 20 Nov, 2019 a las 11:42 PST Esta nueva publicación no sólo tendrá ejercicios, también contará con recetas de comida saludable y consejos para mantener una vida equilibrada, para que sea más sencillo lograr una figura esbelta y un bienestar completo. Al igual que ella, su esposo Chris Hemsworth tiene una de las figuras más atléticas de Hollywood, lo que le ha ayudado a mantener su personaje de “Thor” en las películas de Marvel. Mira en la galería de arriba las mejores fotos de Elsa Pataky.     Ver esta publicación en Instagram           Una publicación compartida de Elsa Pataky (@elsapatakyconfidential) el 25 Oct, 2019 a las 1:51 PDTLee tambiénEmily Ratajkowski impacta con diminuto bikini de leopardoLa modelo reveló algunos secretos sobre su vida y su carrera al ser entrevistada por su colega Ashley Graham  pb",elsa pataky irradia elegancia con look traslucido en madrid,https://www.viveusa.mx/showbiz/elsa-pataky-irradia-elegancia-con-look-traslucido-en-madrid,eluniversal,www.viveusa.mx,7,209
99957ef99bccd47e9a302774e3696e74," 0 % PULSO SOCIAL0 Más de 300 koalas han perdido la vida, debido a los incendios que arrasaron con Australia en los últimos días. Entre las fuertes imágenes de animales atrapados en el fuego, aún hay esperanza: un perro héroe se ha convertido en un suave rescatista perfecto para la ocasión.  Los incendios en AustraliaLas llamaradas en Australia forman parte de la temporada anual de incendios que experimenta este país. Hasta el momento, han destruido cientos de casas y cobrado al menos seis vidas.Aunque se trata de un fenómeno natural, sus efectos se han visto agravados por el calentamiento global, ya que las altas temperaturas secan la vegetación, haciendo que sea más inflamables. La situación también empeora porque la atmósfera es más seca y esto prolonga el fuego.Los 10 desastres naturales más devastadores en la historiaEn cuanto a la fauna local, se calculan cientos de koalas muertos y el hospital especializado Port Macquarie Koala Hospital incluso lanzó una colecta online para el tratamiento médico de los animales, debido a la magnitud de la situación.Este centro veterinario ha atendido al menos a 31 koalas por deshidratación y graves quemaduras. Recordemos que actualmente quedan cerca de 43 mil koalas en estado salvaje en Australia y se trata de una especie enlistada como “vulnerable”.El drámatico rescate de un koalaEn el marco de estos incendios, se ha viralizado un video que muestra a una mujer, llamada Toni, salvar a un koala, a pesar de que esto ponía su propia vida en peligro.En las imágenes, se muestra cómo Toni se quita su camiseta y salta a los árboles para capturar al animal. Después, le echan agua encima y lo cubren con mantas, mientras el koala “llora” de dolor.Afortunadamente para este koala, la ayuda llegó pronto y fue trasladado a un santuario donde ya se recupera de sus heridas e incluso pudo reunirse con la mujer que le salvó la vida.Rescate de un koala♥️, no todos los humanos somos destructivos pic.twitter.com/ov7ECPm7VR— Yani (@Yaniper39098380) November 20, 2019Bear, de perro abandonado a héroeEn medio del caos provocado por los incendios, ha emergido un héroe. Se trata de Bear (Oso), un perro border collie que se dedica a encontrar a los koalas atrapados en el desastre.Bear solía ser una mascota, pero sus dueños descubrieron que padece trastorno obsesivo compulsivo y decidieron abandonarlo en la perrera. Aunque su condición hace que sea difícil verlo como un animal de compañía, le da un talento único para convertirse en un perro rastreador rescatista.Foto: Facebook ifawDe acuerdo con sus entrenadores, Bear es el único perro en el mundo que puede encontrar a los koalas por medio del olor de su pelaje.Desde hace algunos años, Bear trabaja con varios departamentos de bomberos en Australia. Usando botas protectoras para evitar el suelo caliente, es enviado a zonas que han sido quemadas, para encontrar a los koalas que podrían haber quedado atrás.Foto: Facebook ifawCuando Bear encuentra a un koala, debe quedarse sentado cerca de él y esperar a que sus entrenadores lo recompensen con una pelota.Por ahora, Bear no ha encontrado sobrevivientes en la costa este de Australia, la más afectada por los incendios, pero continúa su trabajo para poner a los adorables koalas a salvo. Un verdadero perro héroe.Con infomación de Independent y CBS news",bear el perrito abandonado que salva koalas de incendios,https://de10.com.mx/vivir-bien/bear-el-perrito-abandonado-que-salva-koalas-de-incendios,eluniversal,de10.com.mx,6,272
3f3e658bf1acb50b4a804f4326e86a43,"Walt Disney World Resort anunció el regreso del 4-Park Magic Ticket, un boleto de admisión que permite a los turistas visitar cuatro parques del complejo durante cuatro días. Así los turistas pueden ahorrar unos cuantos dólares. Por ejemplo, las entradas a los parques de Walt Disney World por un día se ofertan desde los $109 dólares hasta  los $149 dólares en las fechas más demandadas (como Navidad). Al comprar 4-Park Magic Ticket, la entrada por un día va desde los $89 dólares hasta $117 dólares en las fechas con más turistas.     Ver esta publicación en Instagram           Una publicación compartida de Walt Disney World (@waltdisneyworld) el 13 Nov, 2019 a las 1:00 PSTA través de su blog, Disney anota que en total, por los cuatro días, los turistas pagan cerca de $366 dólares, aproximadamente $6,936 pesos mexicanos, con el 4-Park Magic Ticket. Recomendamos  Kissimmee en Navidad: parques Disney, Universal y casas de vacaciones Este destino es ideal para ahorrar en tu hospedaje y visitar los mejores parques de Florida El costo puede aumentar o bajar dependiendo de los días seleccionados. Son más baratos de lunes a jueves y en temporada baja. Son más caros viernes, sábado y domingo, especialmente en días festivos. Toma en cuenta que deberás elegir días previos al 30 de septiembre de 2020 y que el boleto vence siete días después de la fecha de inicio seleccionada, por lo que tus visitas a los parques deben ser consecutivas o espaciadas sólo por un día. Por $40 dólares adicionales también puedes entrar a la Experiencia NBA o el parque acuático Disney's Typhoon Lagoon.Con Magic Ticket puedes visitar cuatro de estos parques: Magic Kingdom.Epcot. Disney's Hollywood Studios.Disney's Animal Kingdom.Puedes reservar los boletos en Disneyworld.com/4ParkMagic .Lee El restaurante con mejor vista del parque Star Wars en Disney WorldEl restaurante sirve una gran variedad de platillos españoles, en un ambiente inspirado en el cortometraje ""Destino"", de Salvador Dalí y Walt Disney ",disney world lanza boleto magico para disfrutar cuatro parques,https://www.viveusa.mx/compras/disney-world-lanza-boleto-magico-para-disfrutar-cuatro-parques,eluniversal,www.viveusa.mx,8,176
e58a2618d588bd6933ea57f51964a828," 0 % PULSO SOCIAL0 Los mexicanos somos mundialmente famosos por disfrutar de la comida picante, pero hay que admitir que a veces hasta a nosotros se nos va la mano. En más de una ocasión, seguro te has preguntado “¿cómo me quito lo enchilado?” y ahora, te tenemos la respuesta.Existen muchos mitos al respecto de la comida picante, pero lo cierto es que es muy adictiva. Por más que reneguemos, nunca podremos separarnos de su delicioso sabor.El origen del chileLos primeros chiles aparecieron en la zona cercana a Bolivia. Eran muy pequeños y probablemente fueron distribuidos por aves, ya que estos animales no cuentan con los mismos receptores en la lengua que tienen los humanos.Actualmente, se han creado variedades únicas de chiles para todos los gustos. En general, los chiles de color rojo son menos picantes porque contienen más azúcares. ¿Por qué nos enchilamos?De acuerdo con un estudio de la Universidad de Nuevo México, la capsaicina es un químico presente en los chiles. Cuando comemos comida picante, la capsaicina se une a los receptores en la lengua y éstos envían una señal al cerebro que provoca la sensación de picor. Es la misma señal que se envía cuando tocamos algo caliente, lo que resulta en transpiración.10 platillos mexicanos sólo para extranjeros extremos Bebidas que quitan lo enchiladoPaul Bosland, uno de los directores de esta investigación, explicó que la caseína, una de las proteínas presente en los lácteos reemplaza a los receptores de capsaicina en la lengua, brindando alivio inmediato.Es por ello que, cuando sientas ese picor, lo mejor es tomar un vaso de leche para disminuirlo. El yogurt y lácteos como la crema o helado también son efectivos.Aunque es un mito común, ni el agua ni las bebidas alcohólicas pueden contrarrestar el picante. Ambas bebidas sólo hacen que la capsaicina se distribuya en toda tu boca.Alimentos que quitan lo enchiladoLos carbohidratos también pueden reemplazar a la capsaicina en tu boca, aunque no de manera tan efectiva como lo hace la leche. Puedes encontrarlos en pan o azúcar, aunque esta última es lo mejor.De acuerdo con Bosland, este es el motivo por el que muchos postres mexicanos tradicionales, como el flan, contienen ingredientes como miel y leche.Video:",como quitar lo enchilado alimentos y bebidas que si funcionan,https://de10.com.mx/vivir-bien/como-quitar-lo-enchilado-alimentos-y-bebidas-que-si-funcionan,eluniversal,de10.com.mx,6,166
