uid,body,title,url,newspaper_uid,host,n_tokens_title,n_tokens_body
c4a10e954994294f450a71ba33980de0,"Read in English La Liga MX de futbol será hoy noticia. Nos adelantan que los directivos firmarán con la Unidad de Inteligencia Financiera, que encabeza Santiago Nieto, el primer convenio en todo el deporte mexicano para detectar dinero de origen ilícito en los clubes de futbol. Con esto la Liga se moderniza pero también evita se aplique la extinción de dominio a los clubes, como les ha pasado a algunos en Sudamérica que fueron penetrados por el narcotráfico. No quieren ningún gol del crimen organizado en los equipos nacionales.Con los atentos saludos para el general GaytánTodo un mensaje político el que ayer dieron las fuerzas armadas. El secretario de la Defensa, el general Luis Cresencio Sandoval, no solo expresó el tradicional discurso de lealtad al comandante supremo, sino que declaró el respaldo de la milicia al proyecto de gobierno del presidente Andrés Manuel López Obrador y recordó que tiene la legitimidad que se ganó al haber sido electo en un proceso democrático y transparente. Las palabras del general secretario Sandoval cobran mayor relevancia luego del revuelo que causó un discurso del exsubsecretario de la Defensa, el general Carlos Gaytán, en el que cuestionó las decisiones que ha tomado el presidente Andrés Manuel López Obrador, en especial después del fallido operativo en el que liberó al narcotraficante Ovidio Guzmán. Nos hacen ver que al discurso de ayer solo le faltó cerrar con la frase: “Con los atentos saludos para el general Carlos Gaytán”. ¡Firmes!¿Evo, asilado o secuestrado en México?Rápido arregló Evo Morales el “traspié” que se le salió en plena conferencia de prensa. Y es que el boliviano, quien lleva una semana en México protegido con la figura de asilo político, dijo que se siente secuestrado, pero rápido se dio cuenta de lo que expresó y arregló diciendo que bueno, sí tiene libertad, pero extraña comenzar a trabajar a las 5 de la mañana y terminar a las 11 de las noche, en pocas palabras, extraña la Presidencia a la que tuvo que renunciar tras el conflicto político en su país. Por otra parte, nos comentan que desde hace tres días está en México el que fuera último ministro de Relaciones Exteriores de la administración de Evo Morales en Bolivia, Diego Pary. El excanciller llegó, no procedente de Bolivia, y tampoco entró a México con asilo político ni solicitando refugio. No queda muy claro la calidad migratoria con la que entró, tampoco su procedencia y si pedirá asilo. Don Diego se suma al ex vicepresidente Álvaro García Linera y a la exministra de Salud, Gabriela Montaño, a este ritmo, nos comentan, pronto estará por aquí todo el exgabinete de don Evo.Doblan a opositores en el PresupuestoLa del presupuesto se dio ya como una batalla perdida por los diputados de oposición, pues hasta ayer ya sumaban 290 los legisladores firmantes de la carta “Sí, señor presidente”. Como le informamos en este espacio, diputados de la 4T legislativa: Morena, PT, PES y PVEM firmaron apoyar todo lo que les presenten para dictaminar primero y para avalar ante el pleno, después. Poco a poco fue creciendo la suma de quienes dijeron sin ver el dictamen sí al presidente Andrés Manuel López Obrador, al punto de que si la oposición pensaba convencer con argumentos, ayer ya tuvo que reconocer que se topó con pared. Ahora ya solo queda que no se vaya a caer la operación política que hace falta para poder salir de este tema.","Narcodinero en el futbol, un blindaje",https://www.eluniversal.com.mx/opinion/periodistas-el-universal/narcodinero-en-el-futbol-un-blindaje,eluniversal,www.eluniversal.com.mx,3,296
c9ba1672efc5cee18f98d3ca1bf2e348,"El proceso de consulta para el juicio político contra Donald Trump, Presidente de Estados Unidos, dio ayer un giro bastante inesperado que podría llegar a cambiar el curso de los acontecimientos en el país del norte. Hasta hace unos días, en este mismo espacio adelantábamos que el proceso de impeachment podría incluso resultar beneficioso para la reelección de Donald Trump. Sin embargo, el testimonio de Gordon Sondland, embajador en la Unión Europea echó una cubetada de agua fría al optimismo con el que se veían hasta entonces las audiencias en la Casa Blanca. Sondland fue muy claro en vincular a Trump con un plan que buscaba presionar a Ucrania para forzar una investigación en contra de su opositor Joe Biden y su familia.Sondland no tuvo empacho en vincular a distintos miembros del gobierno federal incluido el propio presidente Trump, pasando por Rudolph Giuliani, con quienes aseguró incluso haber tenido una llamada con una conversación “poco convencional” y en donde habría recibido instrucciones específicas en torno a la relación con el presidente Zellinsky.El testimonio de Sondland es muy importante, pues admite abiertamente haber recibido órdenes directas de Donald Trump en los asuntos que correspondían a la relación con Ucrania y que aun cuando él y otros funcionarios no estaban de acuerdo con las instrucciones recibidas por la vía de Giuliani siguieron esas órdenes.El reconocimiento expreso de trabajar en un quid pro quo entre Trump y el presidente Zellinsky pone el dedo en la llaga pues el propio presidente ha venido negando desde hace tiempo que se haya tratado de algo así, es decir, que nunca se presionó a Ucrania con negar ayuda militar a cambio de una investigación contra los Biden. Lo dicho por Sondland ayer apunta en la dirección contraria y contradice, no sólo los dichos presidenciales sino también otros testimonios presentados en las audiencias ante el Congreso.Lo hecho por Trump encaja dentro de la descripción de soborno, uno de los tres supuestos establecidos por la Constitución de Estados Unidos para enjuiciar y remover a un presidente, el segundo sólo después de la traición.Destaca lo dicho por el embajador en la Unión Europea: “Para el Presidente de Estados Unidos lo más importante era que las autoridades ucranianas anunciaran el inicio de una investigación contra los Biden, sin importar si esta finalmente se llevaba a cabo o no”. Esto es importante pues devela el carácter puramente electoral de todo el asunto, la intención de Trump no era descubrir si en verdad los Biden habían cometido una ilegalidad sino simplemente generar el suficiente ruido mediático para manchar la reputación del expresidente de Estados Unidos.La posición de los republicanos, luego del testimonio de Sondland está ahora bastante comprometida. Por supuesto, los representantes del partido del presidente esperaban que el embajador lo protegiera, lo cual no ocurrió. Esto podrá convertirse en una pesada losa para los representantes republicanos a la hora de intentar seguir defendiendo a Donald Trump y así evitar el tan temido juicio político.Si bien con los testimonios previos había materia suficiente para considerar el juicio político, lo dicho por Sondland ayer se puede convertir en la gota que derrame el vaso. Paradojas del destino que sea un partidario de Trump quien, al parecer, dé el empujón final a un juicio que, luego de esto, ahora sí parece inevitable.Hoy, luego del testimonio de Sondland, parece imposible negar la responsabilidad de Trump. El presidente usó un ejercicio abusivo de su poder en la Casa Blanca al sobornar a las autoridades de Ucrania en su propio beneficio. Ambos temas sólo pueden juzgarse por la vía de un juicio político.Gordon Sondland se ganó, el día de ayer, un lugar en los libros de historia. ",Juicio político a Trump: la gota que derrama el vaso,https://www.eluniversal.com.mx/opinion/solange-marquez/juicio-politico-trump-la-gota-que-derrama-el-vaso,eluniversal,www.eluniversal.com.mx,6,312
301a2d70f6a102c4c19ef78bca1d2e82,"Después de una jornada laboral de casi 12 horas como reportera en una estación de radio, el cuerpo de Dulce Aurora ya no pudo más, colapsó ante una crisis de estrés ocasionada por una fuerte carga de trabajo; ese, fue el diagnóstico médico.Esa noche la mitad de su cara se paralizó e incluso perdió la vista durante algunas horas. La mujer de 29 años de edad recuerda aquel momento como uno de los más angustiantes de su vida. Confiesa que después de ese episodio renunció a su empleo pues nada es más importante que su salud.“El ritmo que se maneja en esta rama del periodismo es de inmediatez total, es una competencia por ver quién saca primero la nota, en ese entorno de trabajo por sí sólo es estresante, mucha adrenalina todo el tiempo. Yo percibía también una falta organización al interior de la empresa, sobre cómo dividir los trabajos, cómo priorizar la información, entonces te mandaban a un evento en un punto de la ciudad y a los cinco minutos ya tenías que estar del otro lado para hacer otra cobertura, eran cosas ilógicas, como si yo pudiera teletransportarme, debía cubrir el evento, tomar la foto, redactar el texto, mandar a internet, editar el audio, entrar al aire, todo en un sólo momento.“Toda esta situación sí afectó mi salud, la acumulación de varios días de dormirme tarde y levantarme muy temprano, correr, pasar horas en el transporte público, me provocó una parálisis facial, estuve con este problema alrededor de un mes, tuve que ir a rehabilitación y quedan secuelas de eso, fue una experiencia muy mala” comenta.Para Dulce Aurora, las extenuantes jornadas de trabajo en la radio local no fue lo único que provocó su parálisis facial, sino principalmente el maltrato de los jefes y la mala organización al interior de la empresa.“El trato de los jefes también era casi inhumano, eso era una de las principales causas de mi estrés, porque si algo no estaba bien, pues lógicamente te llaman la atención, eso lo entiendo, pero además de eso los jefes te humillan, te exponen con tus compañeros, etcétera, eso era algo muy desgastante.“A las personas que viven estrés laboral yo les diría que sí es importante sentirte bien profesionalmente, amar tu trabajo, pero también hay que tener límites, ningún empleo vale la vida o la salud”, comenta.Según datos de la Organización Mundial de la Salud (OMS), México ocupa el primer lugar en cuanto al número de trabajadores con estrés laboral (75%), por encima de China (73%) y Estados Unidos (59%).La OMS detalla que el 25% de los infartos anuales en México son provocados por estrés laboral.Las normas internacionales detallan que lo ideal es que un trabajador labore mil 920 horas al año, en México un trabajador promedio labora 2 mil 255 horas anuales, es decir, 335 horas más de las recomendadas.Norma 035 para mejorar ambiente laboralDesde el 23 de octubre del 2019, cada unidad de trabajo en México debe ajustarse a lo establecido por la Norma 035, impulsada por la Secretaría del Trabajo y Previsión Social, con la que se busca mejorar el entorno de los trabajadores, creando un ambiente agradable y con un trato más humano, que permita a cada persona alcanzar un sano equilibrio entre su vida familiar y laboral. En Querétaro, 85 mil centros de trabajo tienen que ajustarse a esta Norma Oficial Mexicana.De acuerdo con Mónica Sansores, vicepresidenta de International Workplace, señala que la Norma 035 ya ha detonado un cambio evidente en la forma en la que operan las empresas, pues buscan que sus empleados se sientan felices y tranquilos, para de esta forma aumentar la productividad.Mónica Sansores detalla que algunos de los factores que provocan el estrés laboral son: largos recorridos en transporte público para llegar al centro de trabajo, no tener zonas de esparcimiento en sus empresas y laborar aislado de los demás compañeros.“Que puedas trabajar en un lugar que esté cerca de tu casa y por lo tanto que no tardes tanto tiempo en trasladarte, eso seguramente reducirá los niveles de estrés laboral, ya sea que uses transporte público, auto, etc. También ayuda que el lugar de trabajo tenga mobiliario cómodo, que tengan áreas donde puedan convivir con sus compañeros, incluso por ejemplo algún área de juegos.“Sí percibo una intención muy marcada de las empresas por ajustarse a estas nuevas formas de actividad laboral, muchas de ellas se sorprenden porque creen que será algo costoso y no necesariamente es así, además, esto trae una consecuencia positiva para todos, las empresas con empleados felices son las que registran menos rotación de personal”.La vicepresidenta de International Workplace señala que el mejor ambiente de trabajo, y por lo tanto, el que garantiza menos rotación de personal, es una modalidad de trabajo mixta, es decir, que la persona pueda realizar su trabajo en casa, en oficina y en áreas externas.Reiteró que contrario a lo que se cree, el llamado home working es uno de los ambientes laborales que más estresa a las personas, pues se trabaja en aislamiento y sin factores de motivación.Mónica hace un llamado a que los centros de trabajo atiendan lo estipulado en la Norma 035, pues con esto se experimentarán nuevas formas de dirigir sus empresas, cuidando la salud física y emocional de sus trabajadores.",Estrés laboral podría ser letal,https://www.eluniversalqueretaro.mx/portada/estres-laboral-podria-ser-letal,eluniversal,www.eluniversalqueretaro.mx,5,422
bdb70681050934b382d20c3d8a788b79,"Antes de llegar a librerías ocupó el primer lugar en la lista de best sellers para venta electrónica. Se trata de un texto prometido muchas veces por el presidente Andrés Manuel López Obrador a propósito de los valores que mueven las decisiones de su gobierno.Quien vaya buscando en esas páginas un argumento nuevo no lo encontrará. Prácticamente todo lo dicho en este libro lo dijo antes el presidente en alguno de sus discursos más relevantes, o bien en las conferencias que ofrece todas las mañanas a la prensa.Acaso la ventaja de adquirir el texto está en que ahí se sintetizan y ordenan razonamientos presentados, antes, de manera dispersa y también que aquí son explícitas las aspiraciones morales a las que se somete el hombre con mayor poder en México.La moral es un conjunto de restricciones no religiosas ni jurídicas que sin embargo sirven para normar el comportamiento, sea propio o de un grupo humano.En este texto Andrés Manuel López Obrador se vio obligado a compartir, de manera explícita, esas restricciones precisas que no querría traicionar, según su propio discurso y convicciones.No es exacto decir que las limitantes trazadas por su propia mano se circunscriban al ámbito económico, porque en este libro se habla también del poder y la política, de cultura y sociedad y un universo muy vasto de temas que terminan recorriendo la filosofía general del habitante de Palacio Nacional.De acuerdo con su autor, esa filosofía se define en oposición al neoliberalismo; quiere ser una respuesta frente a quienes esgrimían que no hay otro camino posible. De acuerdo con sus propios términos, su moral no concede lugar al autoritarismo, ni a la modernidad construida a partir de la exclusión social; confía al mismo tiempo en que es posible armonizar desarrollo con justicia social.A estos valores se añade una tesis principal: “En este tiempo, hemos decidido convertir la honestidad y la fraternidad en forma de vida y de gobierno.”Se deriva de esa afirmación que su conducción de las decisiones económicas descansa sobre una fraternidad honesta; dos palabras que, por lo general, no se suelen mezclar con la política, tampoco con el poder.No debe sorprender que el libro tenga un par de largos apartados dedicados a sumar anécdotas de la historia mexicana. A ello nos tiene acostumbrados el presidente, para ilustrar sus argumentos.Como lo ha dicho cientos, quizá miles de veces, el presidente afirma aquí que el principal problema del país es la corrupción. Para probarlo comienza citando un relato de Bernal Díaz del Castillo a propósito del robo que Hernán Cortés habría hecho a la corona española y después continúa con otros tantos similares hasta llegar al virrey de Iturrigaray, quien también habría sido un hampón.Sin decirlo explícitamente, este libro concede que lo deshonesto nos llegó a los mexicanos por el lado español y, desde la conquista, se metió en la estructura de la sociedad, nuestra política y la cultura.En esto no se distingue López Obrador de otras voces convencidas de que la corrupción es un vicio ligado a la cultura mexicana; sin embargo, de su lado el presidente está seguro, no solo de que es posible erradicarla, sino también que a él le toca jugar un papel vicario al respecto.López Obrador se impone a sí mismo la misión de cerrar un ciclo muy largo y extenuante, para la economía mexicana, puntuado por actos deshonestos que han producido exclusión y pobreza.Ora que esa misión anticorruptora no puede expresarse en oposición al otro valor central de su moral política: la fraternidad. El presidente explica que para enfrentar las desviaciones prefiere la denuncia pública sobre la persecución legal.Repite una frase que ha usado antes: “No es mi fuerte la venganza, soy partidario del perdón y la indulgencia ...”De esta convicción deriva su ánimo para decretar una República amorosa, concepto que no logra precisar en este libro y sin embargo ha estado muy presente en su narrativa política.ZOOM: Hacia una economía moral es un compendio de los discursos del presidente Andrés Manuel López Obrador, ordenado alrededor de sus principales convicciones filosóficas sobre la honestidad y la fraternidad. Apuntala la narrativa, como suele hacerlo, desde aquellas anécdotas históricas que prueban cuán corrupta y cuán poco solidaria habría sido, hasta su llegada al poder, la historia mexicana. [email protected]",Hacia una economía moral,https://www.eluniversal.com.mx/opinion/ricardo-raphael/hacia-una-economia-moral,eluniversal,www.eluniversal.com.mx,3,345
be52978d301d4a2d20b42d8eae887d7e,"Según los registros de la Liga MX hay 185 jugadores no nacidos en México; extranjeros, pues. La mayoría son argentinos, colombianos, uruguayos, chilenos y ecuatorianos. Cada vez hay menos brasileños y algunos españoles han llegado en tiempos recientes.  Y como cada vez que una selección infantil o juvenil destaca en un Mundial, viene el mismo debate: ¿Se deben reducir los foráneos del futbol mexicano?Países que son potencia con sus selecciones nacionales están llenos de extranjeros en sus equipos de primera y segunda división. España, Italia, Alemania, Inglaterra, Francia, que como la Liga MX no son ligas formativas y que lo que intentan es tener equipos competitivos. México es de los pocos países en el mundo que tiene torneos oficiales Sub-17 y Sub-20, es decir, el problema no es por ahí, sino en las decisiones absurdas de la contratación de futbolistas extranjeros de bajo nivel que representa un negocio más que un aporte futbolístico a los clubes.Nadie debería estar peleado con la calidad y claro que para que un Sub-17 llegue al primer equipo debe pasar filtros que en ocasiones son durísimos para los mexicanos, no tanto para los extranjeros que en ocasiones representan solamente el interés económico del directivo. Leer también: Habrá juego de estrellas de la Liga MX y MLSNo habrá en los equipos de inferiores futbolistas de mayor calidad que por ejemplo Diego Rigonato (31 años)  o Gastón Sauro (29 años) del Toluca; o bien que españoles desechados de sus equipos de origen y que los trajeron a San Luis como estelares y no han servido para maldita la cosa como Ian González (26 años), Pedro Álvarez (37 años) y Unai Bilbao (25 años) o el caso del argentino Ricardo Centurión (26 años). Y así podríamos seguirle: Stephen Eustaquio (22 años), Martín Cauteruccio (32 años) y Edgar Méndez (29 años) del Cruz Azul; Faberth Balda (27 años) del Atlas; Lucas da Silva (25 años) del FC Juárez; Jeison Angulo (23 años) y Martín Rodríguez (25 años) de Pumas. Y la lista podría seguir y seguir. Y no importa que algunos de estos futbolistas, casos San Luis y Bravos, hayan sido figuras en el Ascenso MX, no son material para la Primera División.Entonces, el problema no es la falta de espacios para los mexicanos, es la cantidad inmisericorde de extranjeros de escasa calidad.Otro problema del futbol juvenil mexicano es que muchos padres de familia con tal de que sus hijos sean el negocio que los saque de la pobreza, los sueltan muy fácilmente a buitres disfrazados de promotores o entrenadores, que hacen que caigan en sus manos sin fijarse en realidad a donde van. También y sin poder generalizar, muchos casos de fracasos profesionales que eran juveniles exitosos se debe a que los “marean” en su entorno y los hacen creer que son más de lo que en realidad son.También te puede interesar: La lista de deseos del 'Tata' para los dueños en la Liga MXNo solamente es reducir extranjeros, es detectar la corrupción y que los dueños, los que ponen su dinero, no vuelvan a contar con estos elementos tóxicos que lo que mejor saben hacer es quitarles su dinero, argumentando mentiras para la contratación de futbolistas que no son dignos de una liga que quiere ser grande. @gvlo2008gerardo[email protected] Suscríbete a nuestras redes sociales:   Youtube    Facebook    Twitter Instagram","Mientras haya corrupción, aunque reduzcan extranjeros",https://www.eluniversal.com.mx/opinion/gerardo-velazquez-de-leon/mientras-haya-corrupcion-aunque-reduzcan-extranjeros,eluniversal,www.eluniversal.com.mx,5,280
a75ab540585fa65bbad190e666ece5d4,"    googletag.cmd.push(function() {      googletag.display(""dfp-ad-top3_content"");    });  Emma Coronel Aispuro se integrará al elenco de la serie de VH1, Cartel Crew, reality en el que se reúnen hijos y familiares de poderosos narcotraficantes para intentar ser mejores personas y no seguir los malos pasos de sus familiares.La esposa del capo mexicano, Joaquín ‘El Chapo’ Guzmán Loera, sentenciado a pasar lo que le resta de su vida en una prisión en los Estados Unidos, aparentemente no está relacionada a las actividades criminales de la organización de su esposo, pero durante el juicio fue señalada de ser partícipe de la fuga de su pareja de una cárcel mexicana.Una de las figuras de la serie es Katherine ""Tatu Baby"" Flores, hija de un capo de la droga en Queens, Nueva York, que fue asesinada cuando tenía cuatro años.Es uno de los personajes más populares del Cartel Crew y en diferentes episodios mostró su vida y una de sus prioridades es su hijo.Aunque trató alejarse de los problemas legales, el padre de su hijo recientemente fue encarcelado.Flores y Coronel grabaron parte de la segunda temporada del show en Miami, según medios como el portal de espectáculos TMZ.VER: Emma Coronel, la reina del Chapo Guzmán al paso de los años ",Hija de capo acompaña a Emma Coronel en TV,http://www.unionjalisco.mx/articulo/2019/11/21/espectaculos/hija-de-capo-acompana-emma-coronel-en-tv,eluniversal,www.unionjalisco.mx,6,96
