uid,body,title,url,newspaper_uid,host,n_tokens_title,n_tokens_body
19f0d067a0683c01d889f88bf122c8cc,"La Oficina de Aduanas y Protección Fronteriza anunció que los viajeros que llegan a Estados Unidos la prohibición al acceso de jitomates, chiles y semillas de estos alimentos.Las autoridades estadounidenses aclararon que la restricción aplica para las personas que ingresen por vía terrestre, aérea o marítima a la Unión Americana. Aduanas y Protección Fronteriza (CBP)tomó la decisión de prohibir la importación, luego de que se detectara la presencia del virus “tomato brown rugose fruit”. El Departamento de Agricultura de la Unión Americana asegura que el virus se esparce fácilmente con el contacto de la planta contaminada, aunque sea a través de las manos o herramientas de agricultura. La restricción aplica para los jitomates, chiles y semillas provenientes de México, Israel, los Países Bajos. Además, se inspeccionarán también los productos de Canadá, ya que es un país que importa alimentos mexicanos. La nueva medida entrará en vigor este 22 de noviembre, cuando todos los agentes de Aduanas y Protección Fronteriza negarán la entrada de los chiles y tomates, si los encuentran en el equipaje de pasajeros que buscan ingresar a territorio estadounidense.  No te pierdasAlertan en EU por salmonela altamente resistente en queso mexicanoLos Centros para el Control y Prevención de Enfermedades también encontraron una cepa resistente a los antibióticos en carne de res estadounidense  Además, el Servicio de Inspección de Sanidad Animal y Vegetal revisará todos los cargamentos comerciales de importaciones de estos productos, para certificar que no estén infectados con el virus. El Departamento de Agricultura busca proteger la producción de más de 2.3 mil millones de dólares que tiene Estados Unidos para tomate y chiles al año. Beginning tomorrow, travelers can no longer bring  or  into the US. This action is being taken to protect American agriculture from the Tomato Brown Rugose Fruit Virus. Learn more: https://t.co/KwCjJ9HYIL pic.twitter.com/ELhgTSHDwC— CBP (@CBP) November 21, 2019 Alimentos prohibidos para viajar a Estados Unidos Aduanas y Protección Fronteriza también niega el acceso de frutas como naranjas y manzanas al ingresar a territorio estadounidense. Tampoco se permite el ingreso de algunas verduras, carne, plantas y semillasAsimismo, no se puede sacar frutas y carne estadounidense y tratar de devolverla a Estados Unidos al terminar el viaje, de acuerdo con CBP. Todos los productos agrarios deben ser declarados al momento de ingresar al país. De lo contrario, el viajero tendría que pagar multas de entre 200 y 1,000 dólares, especialmente si el alimento tiene alguna restricciónAdemás, es necesario informar el traslado de plantas, flores cortadas, productos de origen animal y animales vivos. Al declarar los productos agrarios, los agentes podrían darle a la persona la opción de tirar el alimento e ingresar al país, o regresar a su lugar de origen.RecomendamosEsto es lo que puede incluir tu “equipaje personal” al ingresar a México Puedes acceder al país con artículos tecnológicos, de entretenimiento, medicamentos y más de forma gratuita ",prohiben viajar estados unidos con chiles y jitomates desde mexico,https://www.viveusa.mx/compras/prohiben-viajar-estados-unidos-con-chiles-y-jitomates-desde-mexico,eluniversal,www.viveusa.mx,6,265
97d89c0a3fc97fb51246b84b75d6b4b8,"    googletag.cmd.push(function() {      googletag.display(""dfp-ad-top3_content"");    });  La cantante y actriz, Edith Márquez subió una foto a su cuenta de Instagram, donde se ve con unos impresionantes vestidos.En la imagen que subió a su red social escribió “Gracias @gus_matta por permitirme lucir tus hermosos diseños!! Te amo”.Edith Marque sube diversas imágenes en Instagram de todo lo que sucede de su vida profesional además de videos antaño donde ella participaba.Hace unos días, la cuenta de Facebook de la Feria del Caballo Texcoco dio a conocer que Edith Márquez estarán presente en el cartel del palenque 2020.VER: Feria de la Piñata Acolman 2019: El cartel completoTe dejamos el posteo que subió los encargados de esta feria:",Los impresionantes vestidos de Edith Márquez,http://www.unionedomex.mx/articulo/2019/11/21/recreo/los-impresionantes-vestidos-de-edith-marquez,eluniversal,www.unionedomex.mx,4,56
0274127775f9159e53f4c866a5fa68da,"Han pasado exactamente mil 80 días desde que Alejandro Murat Hinojosa (PRI) asumió las riendas de Oaxaca, el 1 de diciembre de 2016. Con 16 pueblos originarios y 417 municipios indígenas, se trata del estado con mayor diversidad cultural de México y el “favorito” del presidente Andrés Manuel López Obrador, pues lo eligió como polo para desarrollar el sur-sureste del país.Justo a la mitad de su mandato, en su Tercer Informe, asegura que se debe aprovechar el momento que vive la entidad, que se han alcanzado niveles históricos de crecimiento económico y que existe gobernabilidad, luego de recibir una entidad “socialmente colapsada”.En entrevista con EL UNIVERSAL, Murat dice que tener el respaldo de la Federación y del Presidente lo compromete a aprovechar esta oportunidad única para trabajar por Oaxaca, pues se trata del aliado que faltaba para que el sur sea partícipe del “concierto de crecimiento”.Asegura que su gobierno tiene el compromiso de escuchar y respetar a los pueblos originarios para que este desarrollo que vive el estado se concilie con su visión del mundo y reconoce que al igual que en todo México, la seguridad es uno de los principales retos de su gobierno.La charla se da en el Centro Cultural y de Convenciones de Oaxaca (CCCO), desde donde ayer dio un balance de estos tres años bajo la premisa de que más que datos, “la gente tiene que escuchar a la gente”.Gobernador, ¿cómo se siente a la mitad del camino y cómo está Oaxaca a tres años?—Hay un estado en paz. Cuando yo llegué, a raíz de Nochixtlán [enfrentamiento entre el magisterio y la Policía Federal que dejó ocho muertos y más de 100 heridos] había un estado colapsado socialmente.Logramos no sólo revertir la tendencia de pobreza, somos el estado que más la redujo, hemos sacado de esta situación a 400 mil oaxaqueños. Por primera vez en la historia, la economía creció a 3.9%, lo que coloca a Oaxaca entre los cinco estados que más crecieron. Encontramos obras abandonadas por más de 10 años, como las dos autopistas Barranca Larga-Ventanilla [a la Costa] y Mitla-Tehuantepec [al Istmo], que afortunadamente ya arrancaron y se contemplan terminar al principio de 2022.Recibí un abasto de medicinas en el sector Salud de 30%, hoy estamos a 85% y nos sumamos a la compra consolidada, para que hubiera transparencia total. También terminamos hospitales abandonados, como el de la Mujer Oaxaqueña.Tenemos una política pública para poder medir el antes y el después de Oaxaca. La mayoría de las obras que se han hecho están encaminadas a mejorar los indicadores de diferentes ejes de mi gobierno.Ha cumplido 301 compromisos de los 600 que hizo en campaña, del resto ¿cuáles representan mayores retos?—El primero es el Corredor Interoceánico. Estoy convencido de que Oaxaca va a poder generar el motor más importante de todo el sureste, está llamado a ser el centro logístico de valor agregado más importante del hemisferio. Es de esos proyectos que hará cambios estructurales en la entidad. Uno de mis objetivos es que este proyecto se consolide, de la mano del presidente Andrés Manuel López Obrador.Desde la perspectiva social, seguir en la ruta de disminuir los indicadores de carencia que mide Coneval, como alimentación, servicios públicos, y seguridad social. Y lo que más ocupa a los oaxaqueños, la seguridad. Por lo menos mantener a Oaxaca entre los 10 estados más seguros, pero mi objetivo sería que fuera el más seguro.El Presidente nos ha visitado 11 veces, ¿qué significa tener la confianza de la Federación?—Es la mejor oportunidad para transformar a Oaxaca. Celebro y agradezco que el Presidente haya volteado al sureste. El norte y el Bajío han tenido crecimiento sostenido de más de 4% por 10 años, pero el sureste quiere también ser parte del concierto de desarrollo económico de México.Los programas que él tiene, como el Corredor Interoceánico, son un músculo muy fuerte para transformar la entidad, pero con un acento muy importante: reconociendo al México profundo, lo que significa una política incluyente. Oaxaca debe estar recibiendo más de 20 mil millones en apoyos sociales, eso ayuda a revertir la pobreza. Hay un equilibrio entre detonadores económicos y la inclusión social.En síntesis diría que es la ecuación perfecta: el gobernador ama a Oaxaca y el Presidente ama a Oaxaca, no es una suma, es una multiplicación pensando sólo en una mejor calidad de vida para los oaxaqueños.¿Por qué consiente tanto el Presidente a Oaxaca?—Vio la grandeza cultural e histórica, que tiene que ver con los pueblos originarios. Y esa cultura ha permitido generar una sinergia especial. Un ejemplo es el tequio y el trabajo comunitario que tienen las localidades, que es la semilla de dos programas muy importantes del gobierno federal: La Escuela es Nuestra y los caminos a comunidades rurales, que en diciembre se entregarán los primeros 30.¿Cómo garantizar que este desarrollo pueda beneficiar y se concilie con la visión del mundo de los pueblos originarios?—Lo que nos hace fuertes es nuestra diversidad, y si la respetamos eso nos hace más fuertes. La mejor ruta es respetándola, a través de la legislación de los usos y costumbres. Por su puesto, donde haya que ampliarse o innovar, a raíz del desarrollo, escuchando y respetando a cada uno de los pueblos originarios, vamos a ir por la ruta correcta.¿Cómo ve los equilibrios y contrapesos en el país?—Yo pienso de manera pragmática. Estoy enfocado en Oaxaca y muy agradecido de trabajar con un Presidente que quiere que le vaya bien a la entidad. Mi aportación es tender puentes y generar acuerdos.¿Qué balance hace de su partido, el PRI, en este momento?—La mejor manera en que yo puedo ayudar es haciendo un buen trabajo, si como gobernador doy los resultados que la ciudadanía espera y rindo cuentas, entonces la gente va a hacer una correlación positiva de lo que representa mi partido. Si no, lo único que haré es lastimar su imagen.",“Hay paz en Oaxaca tras estar colapsado”: Alejandro Murat,https://oaxaca.eluniversal.com.mx/estatal/16-11-2019/hay-paz-en-oaxaca-tras-estar-colapsado-alejandro-murat,eluniversal,oaxaca.eluniversal.com.mx,6,446
408c07a6dc8c2db45e4e6939a907e8e7,"Las hernias son defectos en la continuidad de los tejidos que recubren el abdomen por donde puede llegar el intestino o grasa abdominal, y existen algunos factores de riesgo que pueden incrementar el riesgo de desarrollar una. Así lo explica Eva Ramírez Avilés, especialista en cirugía gastroenterológica y laparoscopía avanzada del Hospital Sedna, quien también señala cuáles son algunos de estos factores de riesgo para que puedas evitarlos y así prevenir la aparición de este problema.1. GenéticaEl principal factor de riesgo para una hernia es el factor genético ya que hay personas que tienen predisposición a desarrollarlas debido a que en su familia existen antecedentes de esta complicación.  2. EmbarazoDurante el embarazo ocurre una expansión del estómago más allá de lo normal, lo que puede hacer que el tejido de la pared abdominal se rompa y algún fragmento del intestino, o de grasa, salga por dicho orificio.  3. ObesidadLa obesidad provoca un efecto similar al que ocurre en las embarazadas pues este padecimiento también provoca la expansión del abdomen. El riesgo de desarrollar una hernia incrementa conforme aumenta también el peso.  4. DiabetesLa diabetes es una enfermedad que daña los diferentes tejidos del cuerpo, incluidos los de la pared abdominal. Esto hace que se vuelvan más frágiles y que sean susceptibles de romperse fácilmente.  5. Tabaquismo El tabaquismo provoca una disminución en la oxigenación en los tejidos, lo que tiene como consecuencia que estos se debiliten, al igual que en la diabetes. Los tejidos frágiles tienen mayor probabilidad de sufrir roturas por donde puede escaparse algún pedazo de intestino.  6. Problemas con el colágenoAunque son poco comunes, existen enfermedades que disminuyen la producción de colágeno en las personas. Quienes padecen este tipo de problemas son susceptibles a desarrollar hernias debido a que los tejidos están formados de esta molécula y su disminución hace que se debiliten.  ",6 razones por las que puede salir una hernia,https://www.elbotiquin.mx/medicina-general/6-razones-por-las-que-puede-salir-una-hernia,eluniversal,www.elbotiquin.mx,4,152
e4420b1dbedf9852c18497315bcc439b,"    googletag.cmd.push(function() {      googletag.display(""dfp-ad-top3_content"");    });  ¿Estás embarazada y padeces diabetes? ¿Fuiste diagnosticada con diabetes gestacional? Fundación Carlos Slim, imparte a través de Capacítate para el empleo el curso ""¿Cómo debo cuidarme si estoy embarazada y tengo diabetes?"".La mujer que tome este curso comprenderá qué es la diabetes gestacional; aprenderá a alimentarse de manera correcta, a realizar actividad física  y a manejar sus emociones durante el embarazo; monitoreará sus niveles de glucosa con regularidad; identificará qué hacer ante la presencia de hipo o hiperglucemia; conocerá la técnica correcta para aplicarse insulina en caso de que sea necesario, y mantendrá un estilo de vida saludable posterior a su embarazo.El curso se imparte gratis. Solamente tienes que registrarte para poder acceder. Da clic en este enlace para obtener más información de este curso.Tipos de diabetesDe acuerdo con los ""Estándares de atención médica en la diabetes"" de la American Diabetes Association (ADA 2019), estas son los tipos de diabetes mellitus:Diabetes tipo 1Se conocía como Diabetes Mellitus insulinodependiente (DMI).Implica una deficiencia absoluta de insulina.Suele aparecer antes o poco después de la adolescencia.Se le conoce como diabetes juvenil o infantil, aunque en realidad no hay edad límite.Los pacientes con diabetes tipo 1 necesitan insulina toda su vida.La ausencia de insulina representa un riesgo de coma diabético.Diabetes tipo 2 Se conoce como resistencia a la insulina.Los pacientes producen suficiente insulina al principio de su enfermedad, pero su cuerpo no puede emplearla de forma correcta para bajar la glucosa en sangre.El sobrepeso y la obesidad son dos factores de riesgo.Se suele diagnosticat después de los 30 años, pero cada vez hay más jóvenes que la padecen.Se puede controlar al vigilar los niveles de glucosa con una dieta para diabéticos y ejercicio. También se pueden emplear medicamentos orales.En caso de no atenderse, puede empeorar y los pacientes llegan a necesitar insulina.Anteriormente se conocía como Diabetes Mellitus no insulinodependiente.PrediabetesSituación de riesgo de desarrollar diabetes tipo 2. La prediabetes es un trastorno en que el nivel de la glucosa en la sangre es mayor de lo normal pero no tan alto como para que sea diabetes. Por ejemplo, cuando la glucosa de sangre en ayunas está entre 100-125 mg/dl.Diabetes gestacionalPor varios años, la diabetes gestacional ha sido definida como cualquier grado de intolerancia a la glucosa durante el embarazo, independientemente de si esta existía antes o después de la gestación. Sin embargo, ante la epidemia de obesidad, se ha detectado que algunos casos se trata de mujeres embarazadas que padecen diabetes tipo 2 .La diabetes gestacional implica riesgos para la madre, el feto y el recién nacido.Diabetes por fibrosis quísticaLas personas que padecen fibrosis quística (enfermedad pulmonar obstructiva crónica) suelen desarrollarla. Diabetes post trasplante Esta condición es frecuente en pacientes que recibieron un trasplante de órgano.Diabetes monogénicaEs poco común, es producto de mutaciones en un gen. Suele afectar a niños y jóvenes con mayor frecuencia, particularmente niños recién nacidos. Representa menos del 5 por ciento de los pacientes afectados por diabetes.El tipo más frecuente de diabetes monogénica es MODY.MÁS INFORMACIÓN SOBRE LA DIABETES:Diabetes, alcohol e hipoglucemia, lo que hay que saber en UN1ÓN CDMX¿Existe la diabetes tipo 3? en UN1ÓN JaliscoTipos de diabetes según ADA 2019Diabetes en México 2019, los datos clave en UN1ÓN PueblaDiabetes, los mitos más frecuentes sobre esta enfermedad en UN1ÓN Edomex ",Fundación Carlos Slim: Curso en línea sobre diabetes gestacional,http://www.unionpuebla.mx/articulo/2019/11/21/salud/fundacion-carlos-slim-curso-en-linea-sobre-diabetes-gestacional,eluniversal,www.unionpuebla.mx,7,275
46c5b9c26da1387122694502572b6562,"    googletag.cmd.push(function() {      googletag.display(""dfp-ad-top3_content"");    });  En el momento que más necesitó Rafael Márquez el apoyo de su familia su esposa, Jaydy Michel, no lo dejó y por redes sociales externo la inocencia de su esposo por la acusaciones de lavado de dinero por parte del Departamento de Tesoro de los Estados Unidos.La vida del ex capitán de la selección de México regresó a una normalidad, sus supuestas infidelidades comenzaron a ser portadas en las revistas del espectáculo sensacionalistas.Primero se rumoró un supuesto desliz de Márquez con la modelo colombiana Carolina Díaz el pasado mes de enero durante un viaje a Mérida.Una semana atrás, TVNotas presentó una serie de fotos donde supuestamente Rafa salió con la conductora de deportes, Patty López de la Cerda, quien se separó de su esposo Cristian Scoponi en medio de rumores de infidelidad.En el reportaje un amigo del ex directivo del Atlas aseguró que la relación extramarital es desde hace varios años, y la integrante de Azteca recibe lujosos regalos del michoacano cada vez que se reúnen.Lo que es de destacar es la mesura de la modelo tapatía en este tipo de escándalos, debido a que no se prestan a ventilar o comentar los rumores.VER: Jaydy Michel desafía a Instagram con video de Rafa",Jaydy Michel calla ante infidelidades de Rafa Márquez,http://www.unionjalisco.mx/articulo/2019/11/21/espectaculos/jaydy-michel-calla-ante-infidelidades-de-rafa-marquez?platform=hootsuite,eluniversal,www.unionjalisco.mx,6,103
7c655a3651441bf38b00a73303c772e5,"La compañía tecnológica Apple inició la construcción de su nueva sede y fábrica de computadoras en la ciudad de Austin, Texas. Lo que se traduce en empleos para quienes habitan la ciudad. Actualmente, la empresa ya emplea a 7,000 trabajadores en la ciudad Texana, un aumento del 50% en los últimos 5 años, pero se prepara para contratar a 15,000 hasta el año 2022. Así lo anunciaron en un comunicado.Apple priorizará la contratación ingenieros eléctricos y ensambladores de electrónica para garantizar la fabricación de las Mac Pro. El crecimiento de Apple en Austin es parte de la expansión nacional de la compañía, anunciada en enero de 2018, para aumentar su inversión en manufactura, ingeniería y otros trabajos. Apple está en camino de contribuir con $350 mil millones a la economía de Estados Unidos. Hasta 2023 contratará a 20,000 empleados adicionales en ciudades de todo el país”, anotan.Recomendamos Austin, la mejor ciudad para vivir en Estados UnidosLa capital obtuvo un puntaje de 7.6 sobre 10 que mide la calidad de vida, costo, oportunidades laborales, entre otros rubros El impacto de Apple en AustinAdemás de comprometerse a crear 15 mil empleos para 2022, la empresa se asoció con Bartlett Tree Experts para preservar y aumentar la cantidad de árboles nativos plantados en la sede de 133 acres. Para minimizar su impacto ambiental, la fábrica de Austin funcionará con energía 100% renovable y estará diseñada para maximizar las áreas verdes. La empresa de productos electrónicos y software también lanzó una iniciativa de Educación Comunitaria en Austin para capacitar a los estudiantes en nuevas tecnologías. El rápido crecimiento económico, atracciones, instituciones culturales y educativas colocan a Austin como la mejor ciudad para vivir en Texas y… en todo Estados Unidos. Esto, según el último reporte de U.S. News. El salario anual promedio de sus residentes es de $50,830 dólares. U.S News destaca que se ha convertido en un importante centro tecnológico y “una opción más asequible para las nuevas empresas que buscan una alternativa a Silicon Valley.Si buscas una ciudad donde mudarte, Austin, Texas, es una de las mejores opciones. Lee ¿Cuánto cuesta estudiar en la Universidad de Texas en Austin?El actor Matthew McConaughey es uno de los egresados destacados y ahora maestro de la institución ",apple se prepara para contratar 15 mil empleados en austin,https://www.viveusa.mx/negocios/apple-se-prepara-para-contratar-15-mil-empleados-en-austin,eluniversal,www.viveusa.mx,6,183
7a665f4db8ba6c0f3cb324264bf24a12,"El Aeropuerto Intercontinental de Querétaro (AIQ) es el tercero con el mayor volumen de carga en el país, informó Marco del Prete Tercero, secretario de Desarrollo Sustentable en la entidad.De enero a octubre del presente año, la carga movilizada desde el AIQ es de 43 mil 349 toneladas, que representan 20% de las operaciones que se lograron en los primeros 14 años de vida del AIQ.De 2004 a 2018, las operaciones estuvieron cerca de las 200 mil toneladas; en 2017, el crecimiento fue cercano a 45%, con respecto del año anterior; en 2018, fue cercano a 50% al alcanzar 53 mil toneladas, y con las operaciones del último trimestre de 2019 se estima superar las cifras del año anterior.“En el área de carga tenemos una capacidad de almacenaje de 9 mil 500 metros cuadrados, con la mejor conectividad; tenemos ventajas competitivas como que 80% de las mercancías se entregan el mismo día que despegan”, explicó.Marco del Prete expuso que la operación de una sola ruta (con las respectivas frecuencias semanales) genera en promedio 15 millones de pesos en derrama económica, esto por los servicios que ocupa y la mercancía que es entregada a diferentes sectores productivos.Esta dinámica de crecimiento, explicó, obliga a las autoridades a seguir invirtiendo en la mejora de los servicios del AIQ, por ello la plataforma de carga será ampliada para facilitar las operaciones en caso de que se reciban más operaciones.Recordó que el AIQ está en la mira para recibir la carga que llega al Aeropuerto Internacional de la Ciudad de México, por lo que necesita adecuar sus instalaciones; en los últimos dos años se han invertido 250 millones de pesos en mejoras para el AIQ, tanto para el servicio de pasajeros como de carga.“Este año estaremos invirtiendo la ampliación de la plataforma de carga en 18 mil metros cuadrados, se implementará este año para cumplir con la posibilidad de más vuelos de carga; hay un estudio del Instituto Mexicano del Transporte que indica que Querétaro podría recibir hasta 150 mil toneladas de carga adicionales a las que actualmente tiene”, destacó el secretario.Sobre los servicios logísticos, Del Prete Tercero informó que aportaron más de 28 mil millones de pesos al Producto Interno Bruto (PIB) del año 2017; además, de acuerdo con datos del Instituto Mexicano del Seguro Social (IMSS), aproximadamente 31 mil 739 personas laboran formalmente en el sector transportes, correos y almacenamiento, lo que representa una participación de 5.1% respecto al total de trabajadores que hay en la entidad.","AIQ, tercero con el mayor volumen de carga en el país",https://www.eluniversalqueretaro.mx/portada/aiq-tercero-con-el-mayor-volumen-de-carga-en-el-pais,eluniversal,www.eluniversalqueretaro.mx,6,192
